{
  "bridge": "norves.editor.bridge",
  "version": "0.1",
  "kind": "response",
  "id": "req-61",
  "sessionId": "sess-7f3a",
  "result": {
    "objectId": "n-1",
    "name": "NodeA",
    "kind": "object",
    "properties": [
      {
        "name": "label",
        "value": "Example Name",
        "valueType": "string"
      },
      {
        "name": "fieldOfView",
        "value": 60,
        "valueType": "number"
      },
      {
        "name": "enabled",
        "value": true,
        "valueType": "boolean"
      },
      {
        "name": "parent",
        "value": null
      },
      {
        "name": "position",
        "value": [0, 1.5, -10],
        "valueType": "vector3"
      },
      {
        "name": "metadata",
        "value": {
          "locked": false,
          "tag": "primary"
        }
      }
    ]
  }
}
