{
  "bridge": "norves.editor.bridge",
  "version": "0.1",
  "kind": "response",
  "id": "req-63",
  "sessionId": "sess-7f3a",
  "result": {
    "types": [
      {
        "typeName": "TypeA",
        "kind": "object",
        "properties": [
          {
            "name": "fieldOfView",
            "valueType": "number"
          },
          {
            "name": "enabled",
            "valueType": "boolean"
          }
        ]
      },
      {
        "typeName": "TypeB",
        "kind": "component",
        "instantiable": false
      },
      {
        "typeName": "camera",
        "kind": "component",
        "instantiable": true,
        "properties": [
          {
            "name": "fieldOfView",
            "valueType": "number"
          }
        ]
      }
    ]
  }
}
